{
  "case_id": "example-case-2024-01",
  "generated_at": "2024-01-20T09:00:00Z",
  "title": "Auftragsaktualisierung: Timeout beim externen Preisdienst",
  "coverage": {
    "note": "Ergebnis des coverage-Befehls, unveraendert uebernommen.",
    "total_events": 4,
    "full_coverage_achieved": true
  },
  "scope_and_caveats": [
    "Zeitstempel der CSV-Quelle enthalten keine Zeitzoneninformation (tz_known=false); Uhrzeiten sind unbestaetigt.",
    "Datensatz umfasst nur den bereitgestellten Exportausschnitt vom 20.01.2024, 08:00-09:00 Uhr."
  ],
  "executive_summary": "Eine von zwei analysierten Auftragsaktualisierungen schlug wegen eines Timeouts beim externen Preisdienst fehl. Die Dataverse Plugin Trace Logs belegen eindeutig eine Ueberschreitung des 3000ms-Zeitlimits.",
  "performance_summary": {
    "duration_ms_percentiles": {
      "p50": 1765,
      "p95": 3120
    },
    "methodology_note": "Keine Baseline vorhanden, Faustregel verwendet.",
    "baseline_comparison": "Keine historische Baseline verfuegbar; Faustwert verwendet (Faustregel: Plugin-Ausfuehrung > wenige Sekunden gilt als auffaellig)."
  },
  "findings": [
    {
      "id": "pricing-service-timeout",
      "category": "error",
      "evidence": [
        {
          "event_id": 1,
          "source_file": "plugintrace.csv",
          "event_time": "2024-01-20T08:12:04.000000Z",
          "correlation_id": "c1111111-1111-1111-1111-111111111111"
        }
      ],
      "severity": "high",
      "occurrence_count": 1,
      "observation": "OrderPlugin (Update) wirft System.TimeoutException beim Aufruf des externen Preisdienstes; PerformanceExecutionDuration=3120ms bei einem von zwei beobachteten Auftraegen.",
      "confirmed_cause": "ExceptionDetails belegt explizit die Ueberschreitung des 3000ms-Zeitlimits beim externen Preisdienst-Aufruf (OrderPlugin.CallPricingService).",
      "impact": "Auftragsaktualisierung schlaegt fehl; betroffene Nutzer erhalten eine Fehlermeldung im Formular.",
      "recommendations": [
        {
          "action": "Zeitlimit fuer den Preisdienst-Aufruf erhoehen und eine Retry-Logik mit Backoff implementieren; alternativ Aufruf asynchron auslagern.",
          "risk": "Laengere Ausfuehrungszeit des Plugins bei generell langsamem Preisdienst.",
          "owner_role": "Plugin-Entwickler/in",
          "rollback": "Zeitlimit-/Retry-Konfiguration auf vorherigen Wert zuruecksetzen.",
          "priority": "P1",
          "expected_effect": "Weniger TimeoutExceptions; Auftragsaktualisierungen schlagen seltener fehl.",
          "validation": "Betroffene Correlation-IDs erneut ausfuehren und PerformanceExecutionDuration sowie ExceptionDetails pruefen."
        }
      ],
      "title": "Timeout beim externen Preisdienst",
      "hypothesis": null
    }
  ],
  "appendix": {
    "batch_count": 1,
    "reduction_root_pack_id": "reduce-L1-00001"
  }
}